{
  "soilHandover": "1.0",
  "handoverId": "019f7e89-fc00-7000-8000-000000000006",
  "projectId": "edge-thin-cautions",
  "title": "Six unexplained gaps tip the band",
  "createdAt": "2026-07-22T10:00:00Z",
  "sections": {
    "projectIdentity": {
      "status": "available",
      "summary": "The project keeps its lasting truth written down in plain files, and each section of this document repeats what the sessions agreed on in full sentences so a cold reader can pick the work up without asking anything. The project keeps its lasting truth written down in plain files, and each section of this document repea."
    },
    "decisions": {
      "status": "available",
      "summary": "We locked the storage layout because rebuilding an index must never lose a document."
    },
    "workflow": {
      "status": "available",
      "summary": "The project keeps its lasting truth written down in plain files, and each section of this document repeats what the sessions agreed on in full sentences so a cold reader can pick the work up without asking anything. The project keeps its lasting truth written."
    },
    "architecture": {
      "status": "available",
      "summary": "The store is rooted at one directory, version 1. xxxxxxxxxxxxxxxxxxxxxxxxxxxxxxxxxxxxxxxxxxxxxxxxxxxxxxxxxxxxxxxxxxxxxxxxxxxxxxxxxxxxxxxxxxxxxxxxxxxxxxxxxxxxxxxxxxxxxxxxxxxxxxxxxxxxxxxxxxxxxxxxxxxxxxxxxxxxxxxxxxxxxxxxxxx"
    },
    "constraints": {
      "status": "available",
      "summary": "One writer at a time, enforced by a lock, 1 root. xxxxxxxxxxxxxxxxxxxxxxxxxxxxxxxxxxxxxxxxxxxxxxxxxxxxxxxxxxxxxxxxxxxxxxxxxxxxxxxxxxxxxxxxxxxxxxxxxxxxxxxxxxxxxxxxxxxxxxxxxxxxxxxxxxxxxxxxxxxxxxxxxxxxxx"
    },
    "rejectedPaths": {
      "status": "available",
      "summary": "The project keeps its lasting truth written down in plain files, and each section of this document repeats what the sessions agreed on in full sentences so a cold reader can pick the work up without a."
    },
    "executiveSummary": {
      "status": "available",
      "summary": "The project keeps its lasting truth written down in plain files, and each section of this document repeats what the sessions agreed on in full sentences so a cold reader can pick the work up without asking anything. The project keeps its lasting truth written down in plain files, and each section of."
    },
    "currentTask": {
      "status": "available",
      "summary": "At capture, the index work was mid-flight. xxxxxxxxxxxxxxxxxxxxxxxxxxxxxxxxxxxxxxxxxxxxxxxxxxxxxxxxxxxxxxxxxxxxxxxxxxxxxxxxxxxxxxxxxxxxxxxxxxxxxxxxxxxxxxxxxxxxxxxxxxxxxxxxxxxxxxxxxxxxxxxxxxxxxxxxxxxxx"
    },
    "latestUserIntent": {
      "status": "available",
      "summary": "The project keeps its lasting truth written down in plain files, and each section of this document repeats what the sessions agreed on in full sentences so a cold reader can pick t."
    },
    "sessionDelta": {
      "status": "available",
      "summary": "The project keeps its lasting truth written down in plain files, and each section of this document repeats what the sessions agreed on in full sentences so a cold reader can pick the work up."
    },
    "blockers": {
      "status": "missing",
      "summary": null
    },
    "nextSteps": {
      "status": "missing",
      "summary": null
    },
    "openQuestions": {
      "status": "missing",
      "summary": null
    },
    "sessionActivity": {
      "status": "missing",
      "summary": null
    },
    "restoreInstructions": {
      "status": "available",
      "summary": "You are continuing this project cold. Read the durable sections first, hold every locked decision with its reason, and begin from the next steps exactly as written. xxxxxxxxxxxxxxxxxxxxxxxxxxxxxxxxxxxxxxxxxxxxxxxxxxxxxxxxxxxxxxxxxxxxxxxxxxxxxxxxxxxxxxxxxxxxxxxxxxxxxxxxxxxxxxxxxxxxxxxxxxxxxxxxxxxxxxxxxxxxxxxxxxxxxxxxxxxxxxxxxxxxxxxxxxxxxxxxxxxxxxxxx"
    },
    "provenanceMap": {
      "status": "missing",
      "summary": null
    },
    "safetySummary": {
      "status": "missing",
      "summary": null
    }
  },
  "code": "#006"
}
