{
  "soilHandover": "1.0",
  "handoverId": "019f7e89-fc00-7000-8000-000000000007",
  "projectId": "edge-thin-problem",
  "title": "A rich capture with a boot prompt far too small",
  "createdAt": "2026-07-22T10:00:00Z",
  "sections": {
    "projectIdentity": {
      "status": "available",
      "summary": "The project keeps its lasting truth written down in plain files, and each section of this document repeats what the sessions agreed on in full sentences so a cold reader can pick the work up without asking anything. The project keeps its lasting truth written down in plain files, and each section of this document repea."
    },
    "decisions": {
      "status": "available",
      "summary": "We locked the layout because a rebuilt index must never lose a document."
    },
    "workflow": {
      "status": "available",
      "summary": "The project keeps its lasting truth written down in plain files, and each section of this document repeats what the sessions agreed on in full sentences so a cold reader can pick the work up without asking anything. The project keeps its lasting truth written."
    },
    "architecture": {
      "status": "missing",
      "summary": null
    },
    "constraints": {
      "status": "missing",
      "summary": null
    },
    "rejectedPaths": {
      "status": "missing",
      "summary": null
    },
    "executiveSummary": {
      "status": "available",
      "summary": "The project keeps its lasting truth written down in plain files, and each section of this document repeats what the sessions agreed on in full sentences so a cold reader can pick the work up without asking anything. The project keeps its lasting truth written down in plain files, and each section of."
    },
    "currentTask": {
      "status": "available",
      "summary": "At capture, the work was mid-flight. xxxxxxxxxxxxxxxxxxxxxxxxxxxxxxxxxxxxxxxxxxxxxxxxxxxxxxxxxxxxxxxxxxxxxxxxxxxxxxxxxxxxxxxxxxxxxxxxxxxxxxxxxxxxxxxxxxxxxxxxxxxxxxxxxxxxxxxxxxxxxxxxxxxxxxxxxxxxxxxxxxx"
    },
    "latestUserIntent": {
      "status": "missing",
      "summary": null
    },
    "sessionDelta": {
      "status": "missing",
      "summary": null
    },
    "blockers": {
      "status": "missing",
      "summary": null
    },
    "nextSteps": {
      "status": "available",
      "summary": "The project keeps its lasting truth written down in plain files, and each section of this document repeats what the sessions agreed on in full sentences so a cold reader can pick t."
    },
    "openQuestions": {
      "status": "missing",
      "summary": null
    },
    "sessionActivity": {
      "status": "available",
      "summary": "The project keeps its lasting truth written down in plain files, and each section of this document repeats what the sessions agreed on in full sentences so a cold reader can pick the work up without a."
    },
    "restoreInstructions": {
      "status": "available",
      "summary": "Continue the work as agreed. xxxxxxxxxxxxxxxxxxxxxxxxxxxxxxxxxxxxxxxxxxxxxxxxxxxxxxxxxxxxxxxxxxxxxxxxxxxxxxxxxxxxxxxxxxxxxxxxxxxxxxxxxxxxxxxxxxxxxxxxxxxxxxxxxxxxxxxxxxxxxxxxxxxxxxxxxxxxxxxxxxxxxxxxxxxxxxxxxxxxxxxxxxxxxxxxxxxxxxxxxxxxxxxxxxxxxxxxxxxxx"
    },
    "provenanceMap": {
      "status": "missing",
      "summary": null
    },
    "safetySummary": {
      "status": "missing",
      "summary": null
    }
  },
  "quality": {
    "missingInputs": [
      "The thread held no material for the remaining sections."
    ]
  },
  "code": "#007"
}
