{
  "soilHandover": "1.0",
  "handoverId": "019f7e89-fc00-737d-a259-29872b6b6d30",
  "projectId": "observed-project",
  "title": "Carries observations from producers this reader has never heard of",
  "createdAt": "2026-07-20T08:00:00Z",
  "sections": {
    "projectIdentity": {
      "status": "missing",
      "summary": null
    },
    "decisions": {
      "status": "missing",
      "summary": null
    },
    "workflow": {
      "status": "missing",
      "summary": null
    },
    "architecture": {
      "status": "missing",
      "summary": null
    },
    "constraints": {
      "status": "missing",
      "summary": null
    },
    "rejectedPaths": {
      "status": "missing",
      "summary": null
    },
    "executiveSummary": {
      "status": "available",
      "summary": "A handover that arrived with evidence attached by tools this reader does not know. The sections are read exactly as they would be without it."
    },
    "currentTask": {
      "status": "missing",
      "summary": null
    },
    "latestUserIntent": {
      "status": "missing",
      "summary": null
    },
    "sessionDelta": {
      "status": "missing",
      "summary": null
    },
    "blockers": {
      "status": "missing",
      "summary": null
    },
    "nextSteps": {
      "status": "missing",
      "summary": null
    },
    "openQuestions": {
      "status": "missing",
      "summary": null
    },
    "sessionActivity": {
      "status": "missing",
      "summary": null
    },
    "restoreInstructions": {
      "status": "missing",
      "summary": null
    },
    "provenanceMap": {
      "status": "missing",
      "summary": null
    },
    "safetySummary": {
      "status": "missing",
      "summary": null
    }
  },
  "observations": [
    {
      "kind": "com.example.measurement",
      "producedBy": "example-service 3.2",
      "producedAt": "2026-07-20T09:00:00Z",
      "data": {
        "result": "whatever the producer records",
        "count": 4,
        "nested": {
          "allowed": true
        }
      }
    },
    {
      "kind": "dev.example.annotation",
      "data": {
        "note": "a third party attached this"
      }
    },
    {
      "kind": "an.unnamespaced.kind",
      "producedBy": "something else",
      "data": {}
    }
  ]
}
