{
  "soilHandover": "1.0",
  "handoverId": "019f7e89-fc00-7e76-92a3-f4671b02fd53",
  "projectId": "text-unit",
  "title": "😀😀😀😀😀😀😀😀😀😀😀😀😀😀😀😀😀😀😀😀😀😀😀😀😀😀😀😀😀😀😀😀😀😀😀😀😀😀😀😀😀😀😀😀😀😀😀😀😀😀😀😀😀😀😀😀😀😀😀😀😀😀😀😀😀😀😀😀😀😀😀😀😀😀😀😀😀😀😀😀😀😀😀😀😀😀😀😀😀😀😀😀😀😀😀😀😀😀😀😀𐐀𐐀𐐀𐐀𐐀𐐀𐐀𐐀𐐀𐐀𐐀𐐀𐐀𐐀𐐀𐐀𐐀𐐀𐐀𐐀𐐀𐐀𐐀𐐀𐐀𐐀𐐀𐐀𐐀𐐀𐐀𐐀𐐀𐐀𐐀𐐀𐐀𐐀𐐀𐐀𐐀𐐀𐐀𐐀𐐀𐐀𐐀𐐀𐐀𐐀𐐀𐐀𐐀𐐀𐐀𐐀𐐀𐐀𐐀𐐀𐐀𐐀𐐀𐐀𐐀𐐀𐐀𐐀𐐀𐐀𐐀𐐀𐐀𐐀𐐀𐐀𐐀𐐀𐐀𐐀𐐀𐐀𐐀𐐀𐐀𐐀𐐀𐐀𐐀𐐀𐐀𐐀𐐀𐐀𐐀𐐀𐐀𐐀𐐀𐐀",
  "createdAt": "2026-07-26T10:00:00Z",
  "sections": {
    "projectIdentity": {
      "status": "available",
      "summary": "Every bounded string in this handover sits exactly on its limit when the limit is counted in Unicode code points, and over it when counted in UTF-16 code units or in UTF-8 bytes. That is the whole point of the fixture: it is accepted, so the unit is the code point."
    },
    "decisions": {
      "status": "missing",
      "summary": null
    },
    "workflow": {
      "status": "missing",
      "summary": null
    },
    "architecture": {
      "status": "missing",
      "summary": null
    },
    "constraints": {
      "status": "missing",
      "summary": null
    },
    "rejectedPaths": {
      "status": "missing",
      "summary": null
    },
    "executiveSummary": {
      "status": "missing",
      "summary": null
    },
    "currentTask": {
      "status": "missing",
      "summary": null
    },
    "latestUserIntent": {
      "status": "missing",
      "summary": null
    },
    "sessionDelta": {
      "status": "missing",
      "summary": null
    },
    "blockers": {
      "status": "missing",
      "summary": null
    },
    "nextSteps": {
      "status": "missing",
      "summary": null
    },
    "openQuestions": {
      "status": "missing",
      "summary": null
    },
    "sessionActivity": {
      "status": "missing",
      "summary": null
    },
    "restoreInstructions": {
      "status": "missing",
      "summary": null
    },
    "provenanceMap": {
      "status": "missing",
      "summary": null
    },
    "safetySummary": {
      "status": "missing",
      "summary": null
    }
  },
  "quality": {
    "missingInputs": [
      "éééééééééééééééééééééééééééééééééééééééééééééééééééééééééééééééééééééééééééééééééééééééééééééééééééééééééééééééééééééééééééééééééééééééééééééééééééééééééééééééééééééééééééééééééééééééééééééééééééééééééééééééééééééééééééééééééééééééééééééééééééééééééééééééééééééééééééééééééééééééééééééééééééééééééééééééééééééééééééééééééééééééééééééééééééééééééééééééééééééééééééééééééééééééééééééééééééééééééééééééééééééééééééééééééééééééééééééééééééééééééééééééééééééééééééééééééééééééééééééééééééééééééééééééééééé"
    ]
  },
  "observations": [
    {
      "kind": "com.example.😀😀😀😀😀😀😀😀😀😀😀😀😀😀😀😀😀😀😀😀😀😀😀😀😀😀😀😀😀😀😀😀😀😀😀😀😀😀😀😀😀😀😀😀😀😀😀😀😀😀😀😀😀😀😀😀😀😀😀😀😀😀😀😀😀😀😀😀😀😀😀😀😀😀😀😀😀😀😀😀😀😀😀😀😀😀😀😀😀😀😀😀😀😀😀😀😀😀😀😀😀😀😀😀😀😀😀😀😀😀😀😀😀😀😀😀😀😀😀😀😀😀😀😀😀😀😀😀😀😀😀😀😀😀😀😀😀😀😀😀😀😀😀😀😀😀😀😀😀😀😀😀😀😀😀😀😀😀😀😀😀😀😀😀😀😀😀😀😀😀😀😀😀😀😀😀😀😀😀😀😀😀😀😀😀😀😀😀",
      "data": {
        "note": "an observation kind at exactly the limit"
      }
    }
  ]
}
