{
  "soilHandover": "1.0",
  "handoverId": "019f7e89-fc00-7e76-92a3-f4671b02fd51",
  "projectId": "boundary-depth",
  "title": "Nesting exactly 32 levels deep",
  "createdAt": "2026-07-24T09:00:00Z",
  "sections": {
    "projectIdentity": {
      "status": "available",
      "summary": "A handover whose attached observation nests to exactly 32 levels. The ingestion boundary decides whether it is read at all."
    },
    "decisions": {
      "status": "missing",
      "summary": null
    },
    "workflow": {
      "status": "missing",
      "summary": null
    },
    "architecture": {
      "status": "missing",
      "summary": null
    },
    "constraints": {
      "status": "missing",
      "summary": null
    },
    "rejectedPaths": {
      "status": "missing",
      "summary": null
    },
    "executiveSummary": {
      "status": "missing",
      "summary": null
    },
    "currentTask": {
      "status": "missing",
      "summary": null
    },
    "latestUserIntent": {
      "status": "missing",
      "summary": null
    },
    "sessionDelta": {
      "status": "missing",
      "summary": null
    },
    "blockers": {
      "status": "missing",
      "summary": null
    },
    "nextSteps": {
      "status": "missing",
      "summary": null
    },
    "openQuestions": {
      "status": "missing",
      "summary": null
    },
    "sessionActivity": {
      "status": "missing",
      "summary": null
    },
    "restoreInstructions": {
      "status": "missing",
      "summary": null
    },
    "provenanceMap": {
      "status": "missing",
      "summary": null
    },
    "safetySummary": {
      "status": "missing",
      "summary": null
    }
  },
  "observations": [
    {
      "kind": "com.example.deep",
      "data": {
        "level": {
          "level": {
            "level": {
              "level": {
                "level": {
                  "level": {
                    "level": {
                      "level": {
                        "level": {
                          "level": {
                            "level": {
                              "level": {
                                "level": {
                                  "level": {
                                    "level": {
                                      "level": {
                                        "level": {
                                          "level": {
                                            "level": {
                                              "level": {
                                                "level": {
                                                  "level": {
                                                    "level": {
                                                      "level": {
                                                        "level": {
                                                          "level": {
                                                            "level": {
                                                              "level": {
                                                                "floor": "the key is sk-boundaryfixture0123456789"
                                                              }
                                                            }
                                                          }
                                                        }
                                                      }
                                                    }
                                                  }
                                                }
                                              }
                                            }
                                          }
                                        }
                                      }
                                    }
                                  }
                                }
                              }
                            }
                          }
                        }
                      }
                    }
                  }
                }
              }
            }
          }
        }
      }
    }
  ]
}
