{
  "soilHandover": "1.0",
  "handoverId": "019f7e89-fc00-737d-a259-29872b6b6d33",
  "projectId": "observed-project",
  "title": "Carries a working.style observation of recorded instances",
  "createdAt": "2026-07-20T08:00:00Z",
  "sections": {
    "projectIdentity": {
      "status": "missing",
      "summary": null
    },
    "decisions": {
      "status": "missing",
      "summary": null
    },
    "workflow": {
      "status": "missing",
      "summary": null
    },
    "architecture": {
      "status": "missing",
      "summary": null
    },
    "constraints": {
      "status": "missing",
      "summary": null
    },
    "rejectedPaths": {
      "status": "missing",
      "summary": null
    },
    "executiveSummary": {
      "status": "available",
      "summary": "A handover with recorded instances of the project's way of working attached as evidence, alongside whatever the workflow section itself says."
    },
    "currentTask": {
      "status": "missing",
      "summary": null
    },
    "latestUserIntent": {
      "status": "missing",
      "summary": null
    },
    "sessionDelta": {
      "status": "missing",
      "summary": null
    },
    "blockers": {
      "status": "missing",
      "summary": null
    },
    "nextSteps": {
      "status": "missing",
      "summary": null
    },
    "openQuestions": {
      "status": "missing",
      "summary": null
    },
    "sessionActivity": {
      "status": "missing",
      "summary": null
    },
    "restoreInstructions": {
      "status": "missing",
      "summary": null
    },
    "provenanceMap": {
      "status": "missing",
      "summary": null
    },
    "safetySummary": {
      "status": "missing",
      "summary": null
    }
  },
  "observations": [
    {
      "kind": "working.style",
      "producedBy": "example-recorder 2.0",
      "producedAt": "2026-07-20T09:00:00Z",
      "data": {
        "instances": [
          {
            "situation": "A change would remove part of an existing UI",
            "response": "Confirm the exact boundary with the owner before removing anything"
          }
        ]
      }
    }
  ]
}
